<?xml version="1.0"?>
<Evolution xmlns:xsi="http://www.w3.org/2001/XMLSchema-instance"
          xmlns="http://mergebench.org/ns"
          xsi:schemaLocation="http://mergebench.org/ns ../../meta/XSL/operations.xsd">

    <SemanticEdit index="0">
        <Semantic>
            <Category>REPURPOSE</Category>
            <Description>
                Change the names of the pets.
                The model is migrated for a new customer with different pets.
            </Description>
        </Semantic>
        <Operation index="0">
            <RenameNode oldNodeName="dog" newNodeName="mouse" />
        </Operation>
        <Operation index="1">
            <RenameNode oldNodeName="cat" newNodeName="hamster" />
        </Operation>
    </SemanticEdit>

    <SemanticEdit index="1">
        <Semantic>
            <Category>SIMPLYFY</Category>
            <Description>
                Remove the age property from the pets.
                The new customer does not need to know the age of the pets.
            </Description>
        </Semantic>
        <Operation index="0">
            <DeleteProperty nodeName="mouse" propertyName="age" />
        </Operation>
        <Operation index="1">
            <DeleteProperty nodeName="hamster" propertyName="age" />
        </Operation>
    </SemanticEdit>

</Evolution>